{"schemaVersion":1,"releaseId":"fixture-v1","contentVersion":"1","routeMode":"primary","initialStateProfile":"normal","contentPath":"./content.json","assetManifestPath":"./assets.json","cacheName":"fixture-v1","compatibleReleaseIds":["fixture-v0"],"map":{"center":[35.64,139.28],"zoom":15,"tileUrl":"","attribution":"test"}}
